{
  "schema_version": "1",
  "id": "release-plan",
  "digest": "sha256:783142979a13c77f4e6d19d4ad2a94af1ac220d96fbbb092e0412e04af6e7e65",
  "definition": {
    "authority": "project",
    "kind": "workflow",
    "id": "release-plan",
    "version": "2.1.0",
    "digest": "sha256:e0dea37d03c31c29ab64f4207db1534efa04630aed2c70b976d2dceab99bac5b"
  },
  "provenance": {
    "authority": "project",
    "origin": "workflow-source",
    "locator": "testdata/representative.workflow.yaml",
    "revision": "release-17",
    "digest": "sha256:e0dea37d03c31c29ab64f4207db1534efa04630aed2c70b976d2dceab99bac5b",
    "metadata": {
      "channel": "stable"
    }
  },
  "source_digests": [
    {
      "format": "workflow",
      "digest": "sha256:e0dea37d03c31c29ab64f4207db1534efa04630aed2c70b976d2dceab99bac5b"
    }
  ],
  "graph": {
    "id": "release-plan",
    "namespace": "example-org",
    "version": "2.1.0",
    "digest": "sha256:e611774cde5720cfa3d63f9fa3e6df5f23cef608ce46faf2f96f5939c15b4b67",
    "provenance": {
      "authority": "project",
      "origin": "workflow-source",
      "locator": "testdata/representative.workflow.yaml",
      "revision": "release-17",
      "digest": "sha256:e0dea37d03c31c29ab64f4207db1534efa04630aed2c70b976d2dceab99bac5b",
      "metadata": {
        "channel": "stable"
      }
    },
    "inputs": [
      {
        "name": "project-id",
        "description": "Project receiving the tasks.",
        "schema": {
          "type": "string"
        },
        "required": true,
        "default": {
          "kind": "literal",
          "literal": "demo-project",
          "source": {
            "format": "workflow",
            "locator": "testdata/representative.workflow.yaml",
            "start_line": 19,
            "start_column": 7,
            "path": [
              "inputs",
              "0",
              "default"
            ]
          }
        },
        "source": {
          "format": "workflow",
          "locator": "testdata/representative.workflow.yaml",
          "start_line": 14,
          "start_column": 5,
          "path": [
            "inputs",
            "0"
          ]
        }
      },
      {
        "name": "tasks",
        "schema": {
          "items": {
            "type": "object"
          },
          "type": "array"
        },
        "required": true,
        "source": {
          "format": "workflow",
          "locator": "testdata/representative.workflow.yaml",
          "start_line": 20,
          "start_column": 5,
          "path": [
            "inputs",
            "1"
          ]
        }
      }
    ],
    "outputs": [
      {
        "name": "summary",
        "schema": {
          "type": "object"
        },
        "value": {
          "kind": "expression",
          "expression": {
            "text": "steps.summarize.outputs.result",
            "source": {
              "format": "workflow",
              "locator": "testdata/representative.workflow.yaml",
              "start_line": 29,
              "start_column": 19,
              "path": [
                "outputs",
                "summary",
                "value",
                "expression"
              ]
            }
          },
          "source": {
            "format": "workflow",
            "locator": "testdata/representative.workflow.yaml",
            "start_line": 29,
            "start_column": 7,
            "path": [
              "outputs",
              "summary",
              "value"
            ]
          }
        },
        "source": {
          "format": "workflow",
          "locator": "testdata/representative.workflow.yaml",
          "start_line": 27,
          "start_column": 5,
          "path": [
            "outputs",
            "summary"
          ]
        },
        "metadata": {
          "audience": "caller"
        }
      }
    ],
    "nodes": [
      {
        "id": "prepare-request",
        "display_name": "Prepare Request",
        "kind": "cmd",
        "config": {
          "command": "echo prepare"
        },
        "outputs": [
          {
            "name": "stdout",
            "schema": {
              "type": "string"
            },
            "source": {
              "format": "workflow",
              "locator": "testdata/representative.workflow.yaml",
              "start_line": 38,
              "start_column": 9,
              "path": [
                "steps",
                "0",
                "outputs",
                "stdout"
              ]
            }
          }
        ],
        "effects": [
          "compute"
        ],
        "timeout": {
          "queue": "5s",
          "execution": "30s"
        },
        "execution_target": {},
        "source": {
          "format": "workflow",
          "locator": "testdata/representative.workflow.yaml",
          "start_line": 34,
          "start_column": 5,
          "path": [
            "steps",
            "0"
          ]
        },
        "provenance": {},
        "metadata": {
          "phase": "setup"
        }
      },
      {
        "id": "create-items",
        "display_name": "Create Items",
        "kind": "mcp",
        "needs": [
          {
            "node": "prepare-request",
            "kind": "data",
            "source": {
              "format": "workflow",
              "locator": "testdata/representative.workflow.yaml",
              "start_line": 48,
              "start_column": 9,
              "path": [
                "steps",
                "1",
                "needs",
                "0"
              ]
            }
          }
        ],
        "ready_when": "all_success",
        "if": {
          "text": "inputs[\"project-id\"] != \"\"",
          "source": {
            "format": "workflow",
            "locator": "testdata/representative.workflow.yaml",
            "start_line": 51,
            "start_column": 9,
            "path": [
              "steps",
              "1",
              "if"
            ]
          }
        },
        "for_each": {
          "items": {
            "text": "inputs.tasks",
            "source": {
              "format": "workflow",
              "locator": "testdata/representative.workflow.yaml",
              "start_line": 52,
              "start_column": 15,
              "path": [
                "steps",
                "1",
                "for_each"
              ]
            }
          },
          "max_concurrency": 4
        },
        "config": {
          "arguments": {
            "project_id": "{{ inputs.project-id }}",
            "title": "{{ item.title }}"
          },
          "server": "torque",
          "tool": "torque_task_create"
        },
        "with": {
          "dry-run": {
            "kind": "literal",
            "literal": false,
            "source": {
              "format": "workflow",
              "locator": "testdata/representative.workflow.yaml",
              "start_line": 63,
              "start_column": 9,
              "path": [
                "steps",
                "1",
                "with",
                "dry-run"
              ]
            }
          },
          "project": {
            "kind": "expression",
            "expression": {
              "text": "inputs[\"project-id\"]",
              "source": {
                "format": "workflow",
                "locator": "testdata/representative.workflow.yaml",
                "start_line": 61,
                "start_column": 16,
                "path": [
                  "steps",
                  "1",
                  "with",
                  "project"
                ]
              }
            },
            "source": {
              "format": "workflow",
              "locator": "testdata/representative.workflow.yaml",
              "start_line": 61,
              "start_column": 16,
              "path": [
                "steps",
                "1",
                "with",
                "project"
              ]
            }
          },
          "title": {
            "kind": "interpolation",
            "interpolation": "Task {{ item.title }}",
            "source": {
              "format": "workflow",
              "locator": "testdata/representative.workflow.yaml",
              "start_line": 65,
              "start_column": 9,
              "path": [
                "steps",
                "1",
                "with",
                "title"
              ]
            }
          }
        },
        "outputs": [
          {
            "name": "result-json",
            "schema": {
              "type": "object"
            },
            "source": {
              "format": "workflow",
              "locator": "testdata/representative.workflow.yaml",
              "start_line": 68,
              "start_column": 9,
              "path": [
                "steps",
                "1",
                "outputs",
                "result-json"
              ]
            }
          }
        ],
        "effects": [
          "mutate"
        ],
        "retry": {
          "attempts": 3,
          "backoff": {
            "strategy": "exponential",
            "initial_delay": "1s",
            "max_delay": "30s",
            "multiplier": 2
          },
          "on": [
            "temporary"
          ]
        },
        "idempotency": {
          "mode": "keyed",
          "key": {
            "text": "inputs[\"project-id\"] + \":\" + item.title",
            "source": {
              "format": "workflow",
              "locator": "testdata/representative.workflow.yaml",
              "start_line": 78,
              "start_column": 24,
              "path": [
                "steps",
                "1",
                "retry",
                "idempotency_key"
              ]
            }
          }
        },
        "timeout": {
          "schedule_to_close": "5m"
        },
        "catch": [
          {